{
  "activation": "inert",
  "catalog_version": "0.1.0",
  "content_sha256": "e8e61beeb9d16b83a810d3fe2412d75ce26a1cc9a3e100ac2858d5a38c6b1560",
  "count": 12,
  "expected_count": 12,
  "kind": "registered_script_catalog",
  "lifecycle_state": "inert",
  "records": [
    {
      "activation": "inert",
      "argv_only": true,
      "asset_id": "script.generic.backup_restore_probe",
      "compatibility": "orchestrator>=0.1.0",
      "content_sha256": "1889ff9398bc9ff607c052ffac9a79dbd553669a2bb189c1ce5f9cd3c5055324",
      "executable": false,
      "hardening": {
        "ephemeral_tmp": true,
        "no_new_privileges": true,
        "non_root": true,
        "read_only_root_fs": true,
        "seccomp": true
      },
      "kind": "registered_generic_script",
      "lifecycle_state": "inert",
      "mutation_class": "evidence_producing",
      "name": "Backup/restore probe",
      "network_policy": "deny_by_default",
      "notes": "Catalog-only at R1; registry presence is not authority.",
      "owner": "platform.orchestrator",
      "provenance": "r1-design-contract",
      "repository_script": true,
      "script_id": "script.generic.backup_restore_probe",
      "sensitivity": "public",
      "source": "agentic/catalogs/scripts.json",
      "version": "0.1.0"
    },
    {
      "activation": "inert",
      "argv_only": true,
      "asset_id": "script.generic.catalog_integrity_sweep",
      "compatibility": "orchestrator>=0.1.0",
      "content_sha256": "d7e2f58703c8a946320b951f00fa0d0c21e2e94bfb66c2ad205bf2b8089d0382",
      "executable": false,
      "hardening": {
        "ephemeral_tmp": true,
        "no_new_privileges": true,
        "non_root": true,
        "read_only_root_fs": true,
        "seccomp": true
      },
      "kind": "registered_generic_script",
      "lifecycle_state": "inert",
      "mutation_class": "evidence_producing",
      "name": "Catalog integrity sweep",
      "network_policy": "deny_by_default",
      "notes": "Catalog-only at R1; registry presence is not authority.",
      "owner": "platform.orchestrator",
      "provenance": "r1-design-contract",
      "repository_script": true,
      "script_id": "script.generic.catalog_integrity_sweep",
      "sensitivity": "public",
      "source": "agentic/catalogs/scripts.json",
      "version": "0.1.0"
    },
    {
      "activation": "inert",
      "argv_only": true,
      "asset_id": "script.generic.dependency_manifest_inventory",
      "compatibility": "orchestrator>=0.1.0",
      "content_sha256": "902699be204ebbf813fa5da9f896ef83a2f68d45eca4d86ff35fa0c4f9827745",
      "executable": false,
      "hardening": {
        "ephemeral_tmp": true,
        "no_new_privileges": true,
        "non_root": true,
        "read_only_root_fs": true,
        "seccomp": true
      },
      "kind": "registered_generic_script",
      "lifecycle_state": "inert",
      "mutation_class": "evidence_producing",
      "name": "Dependency-manifest inventory",
      "network_policy": "deny_by_default",
      "notes": "Catalog-only at R1; registry presence is not authority.",
      "owner": "platform.orchestrator",
      "provenance": "r1-design-contract",
      "repository_script": true,
      "script_id": "script.generic.dependency_manifest_inventory",
      "sensitivity": "public",
      "source": "agentic/catalogs/scripts.json",
      "version": "0.1.0"
    },
    {
      "activation": "inert",
      "argv_only": true,
      "asset_id": "script.generic.documentation_link_sweep",
      "compatibility": "orchestrator>=0.1.0",
      "content_sha256": "e6ab825f97ee8440f497d443e71229c881f271ed1e5a6ea295bbe4352e7d5029",
      "executable": false,
      "hardening": {
        "ephemeral_tmp": true,
        "no_new_privileges": true,
        "non_root": true,
        "read_only_root_fs": true,
        "seccomp": true
      },
      "kind": "registered_generic_script",
      "lifecycle_state": "inert",
      "mutation_class": "evidence_producing",
      "name": "Documentation link sweep",
      "network_policy": "deny_by_default",
      "notes": "Catalog-only at R1; registry presence is not authority.",
      "owner": "platform.orchestrator",
      "provenance": "r1-design-contract",
      "repository_script": true,
      "script_id": "script.generic.documentation_link_sweep",
      "sensitivity": "public",
      "source": "agentic/catalogs/scripts.json",
      "version": "0.1.0"
    },
    {
      "activation": "inert",
      "argv_only": true,
      "asset_id": "script.generic.documentation_metadata_sweep",
      "compatibility": "orchestrator>=0.1.0",
      "content_sha256": "b7c03d69ed88495023e49c6f214170e7b311a368b1c49b001bd97ea7289d8467",
      "executable": false,
      "hardening": {
        "ephemeral_tmp": true,
        "no_new_privileges": true,
        "non_root": true,
        "read_only_root_fs": true,
        "seccomp": true
      },
      "kind": "registered_generic_script",
      "lifecycle_state": "inert",
      "mutation_class": "evidence_producing",
      "name": "Documentation metadata sweep",
      "network_policy": "deny_by_default",
      "notes": "Catalog-only at R1; registry presence is not authority.",
      "owner": "platform.orchestrator",
      "provenance": "r1-design-contract",
      "repository_script": true,
      "script_id": "script.generic.documentation_metadata_sweep",
      "sensitivity": "public",
      "source": "agentic/catalogs/scripts.json",
      "version": "0.1.0"
    },
    {
      "activation": "inert",
      "argv_only": true,
      "asset_id": "script.generic.git_diff_summary",
      "compatibility": "orchestrator>=0.1.0",
      "content_sha256": "be41e71ac9a3c697c21ea76d0966a896788812471b6d0a1178ec9e9db484b33b",
      "executable": false,
      "hardening": {
        "ephemeral_tmp": true,
        "no_new_privileges": true,
        "non_root": true,
        "read_only_root_fs": true,
        "seccomp": true
      },
      "kind": "registered_generic_script",
      "lifecycle_state": "inert",
      "mutation_class": "read_only",
      "name": "Git diff summary",
      "network_policy": "deny_by_default",
      "notes": "Catalog-only at R1; registry presence is not authority.",
      "owner": "platform.orchestrator",
      "provenance": "r1-design-contract",
      "repository_script": true,
      "script_id": "script.generic.git_diff_summary",
      "sensitivity": "public",
      "source": "agentic/catalogs/scripts.json",
      "version": "0.1.0"
    },
    {
      "activation": "inert",
      "argv_only": true,
      "asset_id": "script.generic.governance_integrity_sweep",
      "compatibility": "orchestrator>=0.1.0",
      "content_sha256": "583e9351b8190c157a58262a60d25e57042be381d1a79042c52d940e07105d74",
      "executable": false,
      "hardening": {
        "ephemeral_tmp": true,
        "no_new_privileges": true,
        "non_root": true,
        "read_only_root_fs": true,
        "seccomp": true
      },
      "kind": "registered_generic_script",
      "lifecycle_state": "inert",
      "mutation_class": "evidence_producing",
      "name": "Governance integrity sweep",
      "network_policy": "deny_by_default",
      "notes": "Catalog-only at R1; registry presence is not authority.",
      "owner": "platform.orchestrator",
      "provenance": "r1-design-contract",
      "repository_script": true,
      "script_id": "script.generic.governance_integrity_sweep",
      "sensitivity": "public",
      "source": "agentic/catalogs/scripts.json",
      "version": "0.1.0"
    },
    {
      "activation": "inert",
      "argv_only": true,
      "asset_id": "script.generic.queue_worker_heartbeat_health",
      "compatibility": "orchestrator>=0.1.0",
      "content_sha256": "a8b9a30ee2acebe7c18a56e92a1a852b5947d1bbf227b5fb6bb6a852801a34ff",
      "executable": false,
      "hardening": {
        "ephemeral_tmp": true,
        "no_new_privileges": true,
        "non_root": true,
        "read_only_root_fs": true,
        "seccomp": true
      },
      "kind": "registered_generic_script",
      "lifecycle_state": "inert",
      "mutation_class": "read_only",
      "name": "Queue/worker/heartbeat health",
      "network_policy": "deny_by_default",
      "notes": "Catalog-only at R1; registry presence is not authority.",
      "owner": "platform.orchestrator",
      "provenance": "r1-design-contract",
      "repository_script": true,
      "script_id": "script.generic.queue_worker_heartbeat_health",
      "sensitivity": "public",
      "source": "agentic/catalogs/scripts.json",
      "version": "0.1.0"
    },
    {
      "activation": "inert",
      "argv_only": true,
      "asset_id": "script.generic.repository_health",
      "compatibility": "orchestrator>=0.1.0",
      "content_sha256": "38beda0cd2483cf4bec27a993387d3ad4b094f3dee9670feed001892fd35cd53",
      "executable": false,
      "hardening": {
        "ephemeral_tmp": true,
        "no_new_privileges": true,
        "non_root": true,
        "read_only_root_fs": true,
        "seccomp": true
      },
      "kind": "registered_generic_script",
      "lifecycle_state": "inert",
      "mutation_class": "read_only",
      "name": "Repository health",
      "network_policy": "deny_by_default",
      "notes": "Catalog-only at R1; registry presence is not authority.",
      "owner": "platform.orchestrator",
      "provenance": "r1-design-contract",
      "repository_script": true,
      "script_id": "script.generic.repository_health",
      "sensitivity": "public",
      "source": "agentic/catalogs/scripts.json",
      "version": "0.1.0"
    },
    {
      "activation": "inert",
      "argv_only": true,
      "asset_id": "script.generic.repository_inventory",
      "compatibility": "orchestrator>=0.1.0",
      "content_sha256": "e77829e3634f027c08366822795db9c555e0378f7a600ad8e2d490aefa2281b6",
      "executable": false,
      "hardening": {
        "ephemeral_tmp": true,
        "no_new_privileges": true,
        "non_root": true,